id,url,title,score,num_comments,created_utc,selftext
5r8noy,https://www.reddit.com/r/georgetown/comments/5r8noy/thanks_for_reporting_spam/,Thanks for reporting spam,9,2,2017-01-31 07:01:11,"Hi everyone,

Thank you all for staying vigilant and reporting spam. I am not sure why we are getting hit so hard with it lately, but I am hoping to find a more proactive way to combat spam.

Anyway, thanks for staying on top of it and please continue to report anything strange.

Best,

sos"
5wicss,https://www.reddit.com/r/georgetown/comments/5wicss/how_do_you_find_and_connect_with_nature_at/,How do you find and connect with nature at Georgetown?,4,5,2017-02-27 10:20:05,"Over and over again, studies have shown that people who live in greener areas are happier and students that are surrounded by nature perform better. Although Georgetown isn't the most urban school in DC, our campus is nonetheless severely lacking in green space. How do you find ways to connect with nature at Georgetown? What are your favorite green spaces on campus or in the city?

Studies:

https://www.eurekalert.org/pub_releases/2017-02/uoe-wbn022417.php

http://horttech.ashspublications.org/content/18/2/232.full"
60fkrh,https://www.reddit.com/r/georgetown/comments/60fkrh/looking_for_friends/,Looking for friends,10,2,2017-03-20 02:42:48,"Hi everyone, I'm not a Georgetown student (I have an ID but that was from summer classes before) and I'm from around the area. I'm currently taking a gap year so it's been pretty hard to meet new people. I was wondering if there's anyone that has similar interests who would be down to hang out or something. I'm half Japanese and half Spanish, I'm learning how to cook and learning to become a professional pastry chef as well. I'm interested in subjects ranging from international relations/politics to computer science/engineering (I went to HoyaHacks). I'm also pretty into Japanese culture."
66f7ql,https://www.reddit.com/r/georgetown/comments/66f7ql/connect_with_class_of_2021/,Connect with class of 2021,8,5,2017-04-19 20:24:51,"Having decided to go to Georgetown as a part of the class of 2021 I have been looking for ways to connect with others who are planning to go. However, I haven't been able to find a good way to connect and I'm not able to go to the GAAP weekends. Does anyone know if there is a class groupme or something, or would anyone be up to creating or joining one to connect with fellow Hoyas?"
68vggi,https://www.reddit.com/r/georgetown/comments/68vggi/dps_catches_clock_thief_hands_returned_for_the/,DPS catches Clock Thief. Hands returned for the first time by student and not anonymous drop-off.,9,1,2017-05-02 12:49:37,Official statement will be made in a bit.
6bf7c1,https://www.reddit.com/r/georgetown/comments/6bf7c1/mcdonough_school_of_business_undergraduate/,"McDonough School of Business undergraduate students, how has your time at the school been?",7,6,2017-05-15 20:46:54,"I plan on applying next year and would like to hear from students about their experience at the school regarding campus culture, internship opportunities, classes, pressure, etc.

Thanks!"
6hn0zt,https://www.reddit.com/r/georgetown/comments/6hn0zt/healy_hall_evacuated_while_mpd_investigates/,Healy Hall evacuated while MPD investigates,6,0,2017-06-16 07:57:17,"This alert was just sent out: 

""As a precaution,  Healy Hall has been evacuated to allow for a MPD investigation. Please avoid Healy Hall and the surrounding area. We will notify you when the area is cleared.""

Anyone have any more info?

Edit: It was a ""nonspecific bomb threat"""
6pz8vt,https://www.reddit.com/r/georgetown/comments/6pz8vt/secrets_of_campus/,Secrets of Campus,14,8,2017-07-27 14:38:34,"I will now review the secrets hidden among the banners gleaming in Georgetown's blue and gray. This arcane knowledge took me two years to collect. I share it with you in hopes that a) you become the coolest person in your NSO group and b) all of you pursue new secrets and don't keep discovering the same things. I am leaving out a few details to protect the guilty.

at GUPD: my knowledge of these locations is completely secondhand and not a confession that I have been to all of them.

sub-Healy Tunnels: The first stop on a tour of the Georgetown obscure is the tunnels under Healy. They are accessible through the ""Rain Door,"" which is accessed by opening a gate next to a tunnel near Dahlgren. The door is only unlocked after a heavy rain. Entering leads you to the university's steam pipe distribution venue. If you crawl through a hole in the wall, you'll end up in a series of pitch black and piping hot tunnels, from which you can access the Davis Performing Arts Center and the front of Healy Hall. Painted on the walls are sentimental recollections of secret societies of Georgetown yore, most prominently the knives and fives, Crux Orbis, and SigEp (not really a secret but they did a nice paint job). Allegedly one part of the tunnel used to lead to Walsh, but it has since been bricked up. Many workers have been reported entering and exiting the tunnels. It is likely the makeup has changed fundamentally over the last few months. The university has ambitions to convert this glitter-covered cave (and short list candidate for Exorcist locations) into more offices. Approach with caution. One note: there is a strange broken ladder that would theoretically go up the north Healy tower. Let me know if anyone wants to climb it.

The Russian Door: Not as fun as the Tunnels. Climb the Healy stairs nearest to VilA and you'll find a severely damaged door with Russian writing over the door. I had someone translate it for me once but I forget what it said. I heard rumors my first year of somebody getting through, but they wouldn't say what is behind it. Pretty boring, but worth a look.

Healy Tower: The Holy Grail of Georgetown spelunking is getting up into the clock tower. Security is extremely heavy. I'm work-study, so I've never tried. Admin took a friend of mine up and she said the security is heavier than they let on. And Gruber's fingerprint thing is BS.

Reiss Tunnels: In a classroom on the main floor of Reiss there is a door. That door leads into an impossibly long hallway filled with rusted pipes and random household objects. Looks like something from House of Leaves. Follow the tunnel, and you'll find yourself in Kober-Cogan, MedStar's abandoned psychiatric unit.

Kober-Cogan (home to MK-ULTRA): Kober-Cogan is a six floor abandoned office facility that the university doesn't have the cash to knock down. Ignorant people enter through a window. Smart people go through Reiss. It's creepy. On the lower levels, you'll find rooms with restraints and gurneys and writing on the walls. On the upper floors you'll find plenty of office supplies. K-C was allegedly abandoned midday due to an asbestos assessment. Last time some folks tried to go there GUPD was monitoring the Reiss entrance. Rumor has it admin is getting ready to demolish the building.

.#BirdsChirpingManiacally: Alas, #BirdsChirpingManically is no longer with us. If you entered a particular door of Leavey and climbed the stairs, you found yourself in a room with #BirdsChirpingManically painted on a wall. On the wall there was a tac board. Remove the board and you could enter an abandoned elevator shaft covered in -- frankly -- disturbing drawings. I went there last year for auld lang syne and the university had bricked up my elevator shaft.

The Observatory: Use this one sparingly. Up on the far side of campus next to Kehoe Field there is an almost-abandoned observatory and a nice garden with a few discrete benches. Respect the garden. Everybody is always trying to break into the observatory. Wonder no longer. Join the Astronomy Club. They have the key to the observatory and go there Tuesday nights. Join us in leeching off their free food and enjoying the view from the tower.

Key Bridge: Allegedly one of the secret societies has a tunnel to the base of Key Bridge. If you look at the base of Key Bridge, there are a series of doors. I've never been inside to find out what's there.

Walsh Tunnels: Go into the men's restroom at the bottom of the stairs in Walsh. There is a door. It's locked now but it used to not be. It leads to an extensive tunnel network that is much creepier and much more dangerous than the one under Healy. One might burn one's hand on an exposed pipe.

Bonus - Stewards Clock: Want to impress your NSO group with your knowledge of our dysfunctional, factionalized secret society? Look at the base of the misplaced clock in Red Square. The brass plaque memorializes some guy, says he's a *Steward* and has two keys (their symbol). 

Double Bonus - at one point someone mentioned a secret room in New South. That would require going in New South, so I haven't been.

Feel free to comment with stuff I've missed."
6s0viw,https://www.reddit.com/r/georgetown/comments/6s0viw/to_the_student_who_saved_my_life_today/,To the student who saved my life today,20,0,2017-08-06 13:51:30,"I'm sorry I didn't thank you earlier. I was literally in shock and don't remember you pulling me away from the car. I was too preoccupied with getting home a few minutes earlier to notice the car barreling towards me, and I almost paid for that silly mistake with my life.

I deserved all the shit you and my dad gave me. Judging by your t shirt, I think you're in a sorority? Alpha chi omega? Please contact me and let me give you my thanks. Not all traffic is nice and slow as it is in Williamsburg, and this was almost the worst way to learn that lesson. 

Tl;dr please look both ways, I will every time from now"
79315m,https://www.reddit.com/r/georgetown/comments/79315m/competitiveness_of_physics_program/,Competitiveness of physics program?,3,6,2017-10-27 05:53:04,"Looked for similar articles already posted on this Reddit but could not find it and I know I could email the department but there is the possibility they could undermine it or make it seem harder than is. Basically, I am still a high school student but Georgetown seems like a good fit school for me and I would enjoy knowing how hard the program is

Thanks and lots of love."
7clt73,https://www.reddit.com/r/georgetown/comments/7clt73/best_seats_at_a_hoyas_basketball_game/,Best seats at a Hoyas basketball game,6,3,2017-11-13 00:30:51,"Hey everyone,

I'm a big Knicks fan and seeing Patrick Ewing take the floor as the head coach of the Hoyas is amazing. As such, I'm going to catch an early season game at Verizon and watch the Hoyas.

Wanted to ask, what are the best sections to sit? Looks like the student section is baseline (FYI I'm not a student, just a regular dude off the street) but where are the best seats. Seems like there are always a bunch left on stubhub so I might just pick the best seats and try my luck, but I don't want to sit in a crappy area I want to be in a good spot to catch the action and atmosphere."
7k1p60,https://www.reddit.com/r/georgetown/comments/7k1p60/got_into_georgetown_sfs_early_have_an_important/,Got into Georgetown SFS early!! Have an important question though,6,11,2017-12-15 10:46:04,"I am absolutely thrilled at being admitted and am mostly going to attend Georgetown. However, I have a single question -  Can a student from SFS also double major in Georgetown Engineering or Georgetown college? As someone wanting to do International Politics as well as Computer Science, I am curious to know if I can double major in both of these. Thanks!"
7pgpqi,https://www.reddit.com/r/georgetown/comments/7pgpqi/touring_georgetown_u/,Touring Georgetown U,6,2,2018-01-10 08:32:31,"How accessible is Georgetown, I want to walk around and see the campus but since it’s private I’m worried it’ll be gated and we won’t be able to walk around very much, any idea if people can just walk around??"
7v55cr,https://www.reddit.com/r/georgetown/comments/7v55cr/party_scene/,Party scene?,4,1,2018-02-03 22:14:07,I’m a college student visiting from Baltimore and I’m wondering what the best bars/clubs are that Georgetown kids generally go to
87vzvu,https://www.reddit.com/r/georgetown/comments/87vzvu/decision_time_georgetown_v_u_of_michigan/,Decision Time: Georgetown v. U of Michigan,6,8,2018-03-28 15:02:12,"Hi all! Super excited to say that I've been accepted to both Georgetown's McCourt School of Public Policy AND University of Michigan's Ford School of Public Policy. In both, I'm going for my masters of public policy. Little about me: I'm originally from Michigan so I know UofM however I don't know Georgetown that well.

Question: What are the pros/cons of the McCourt School?"
8e03jn,https://www.reddit.com/r/georgetown/comments/8e03jn/preorientation_info_for_committed_and_happy_hoya/,Pre-Orientation info for committed and happy hoya,8,5,2018-04-21 18:16:50,"Hey Georgetown,
I decided to commit after gaap weekend (really upbeat atmosphere and undergrad business&gt;&gt;&gt;uchicago) and couldn’t be happier with my decision. The only area that the gaap people seemed relatively unfamiliar with beyond the basic info presented on the website were the pre-orientation programs. I think the business one and PEP look really fun and plan on applying to both. Anyone here know what the applications are like and how competitive these are? Thanks, and Hoya Saxa!"
8kvbol,https://www.reddit.com/r/georgetown/comments/8kvbol/congratulations_class_of_2018_hoya_saxa_forever/,CONGRATULATIONS CLASS OF 2018!! HOYA SAXA FOREVER!!,33,1,2018-05-20 13:32:09,It's been a ride
8q77ym,https://www.reddit.com/r/georgetown/comments/8q77ym/recommended_coursesprofessors/,Recommended Courses/Professors,6,12,2018-06-10 23:03:06,What courses do you recommend for an incoming freshman in the college? Also which professors do you recommend? Any to avoid? Thanks! 
90j2rc,https://www.reddit.com/r/georgetown/comments/90j2rc/subject_tests/,Subject Tests,5,9,2018-07-20 12:39:52,"Is 'strongly recommended' essentially required? For EA, how necessary is it to have 3 oppose to two subject tests"
99hj62,https://www.reddit.com/r/georgetown/comments/99hj62/sfs_admittance_process_question/,SFS admittance process question,6,8,2018-08-22 14:52:42,"Hi everyone, 

I'm looking at applying to Georgetown's Foreign Service Master's program. I'm wondering if anyone is in this program or graduated from it that can answer questions for me. 

&amp;#x200B;

Does anyone know the admittance process? I have a lower GPA from my undergrad due to some traumatic situations but have great GRE scores. My work resume is about 7 years long of senior level political work though not international. 

Any information or relevant opinions would be helpful. 

Thanks,"
9h1n8s,https://www.reddit.com/r/georgetown/comments/9h1n8s/how_to_deal_with_repeated_rejection_from_clubs/,How to deal with repeated rejection from clubs?,11,8,2018-09-18 20:20:45,"Hey guys, I’m hoping some of you can relate and maybe share advice. 

I’m a first-year and I’ve been rejected to everything I’ve applied/tried out for. Not just rejected straight out but I’ve gone to the last round of interviews, wrote thousands of words for applications, and spent so much of my time hoping I’ll be accepted. 

And I’m not just applying to get accepted, I really really wanted to be a part of and do these things here. 

Any advice for dealing with this? It’s tough cause my roommate has been accepted to the Corp and has that nice social group whereas I don’t really have a group yet. (And yes I am joining no-app clubs but it’s really not the same)"
9posqe,https://www.reddit.com/r/georgetown/comments/9posqe/moving_to_dc/,Moving to DC!,1,3,2018-10-19 15:45:25,Hey everyone! I am a recent grad from UC Berkeley and I just got a job near DC. I am looking for places to rent currently and was wondering if you all had any pointers. What areas tend to have lower rent prices? What areas are connected to the city via public transport
9vl992,https://www.reddit.com/r/georgetown/comments/9vl992/how_much_is_high_school_taken_into_account_for/,How much is High school taken into account for folks who’ll have their AA?,1,2,2018-11-09 07:17:33,"Georgetown specific here: I did shit in high school, it was a mix of my epilepsy and simply not caring or having motivation. I graduated somewhere between a 2.5 and a 3.0, somewhere around there. I however took my ACT at the end of my high school career and got a 35 once I got my shit together. I have so far been in community college and currently have a 4.0 in a honors program for a dual degree in international relations and political science. I have good recommendations from my professors and an awesome essay. Besides my high school everything is pretty great. Most colleges besides Ivies don’t consider High School that much or at all for transfers in their second year. I know transferring with such a low acceptance rate is a crapshoot for most students, but how likely is it that I’ll get in? Will high school hurt me at all?"
abeyxt,https://www.reddit.com/r/georgetown/comments/abeyxt/are_three_subject_tests_necessary/,Are three subject tests necessary?,1,1,2018-12-31 20:35:05,"So, I’m one of those economically disadvantaged folks and I wanted to know if three subject tests are absolutely necessary to get in or if my chances will be significantly reduced if I don’t have them because I couldn’t afford another."
afqjrj,https://www.reddit.com/r/georgetown/comments/afqjrj/01142019_gu_main_med_scs_campuses_closed_with/,"01/14/2019 GU Main, Med &amp; SCS campuses CLOSED with Instructional Continuity",1,1,2019-01-13 17:34:17,"Text message:

&gt; 01/14/2019 GU Main, Med &amp; SCS campuses CLOSED with Instructional Continuity. On-site instruction canceled. Emergency employees report to work on time.

Please check the [university operating status page](https://www.georgetown.edu/operating-status) for more details. *Note: not yet updated as of 1/13/18 @ 8:33pm.*"
atchvb,https://www.reddit.com/r/georgetown/comments/atchvb/how_to_get_into_the_healy_clocktower/,How to get into the Healy Clocktower?,7,4,2019-02-21 19:29:25,It's been a while since it's been done... If you don't feel comfortable posting publicly then PM me
b0o8lg,https://www.reddit.com/r/georgetown/comments/b0o8lg/georgetown_student_gloats_about_cheating_on_her/,Georgetown student gloats about cheating on her SAT and writes about her tennis ranking while not even playing one tournament...,35,4,2019-03-13 09:50:32,https://www.thedailybeast.com/georgetown-rich-kid-isabelle-henriquez-gloated-after-allegedly-cheating-sats
b7muz2,https://www.reddit.com/r/georgetown/comments/b7muz2/current_georgetown_student_ama/,Current Georgetown student AMA,11,44,2019-03-31 04:39:29,"Hey, I’m a junior at Georgetown - been seeing a lot of questions from admitted students and figured this might help, feel free to ask me anything about Georgetown! "
bakpn2,https://www.reddit.com/r/georgetown/comments/bakpn2/gtown_social_scene/,Gtown Social Scene,8,6,2019-04-07 13:27:10,"Hi everyone, I was recently accepted to MSB for the class of 2023, and I was wondering how social life is at gtown. Are people cliquey? How is night life/the party scene? Idk have you guys all managed to have a good time here?"
bcho3r,https://www.reddit.com/r/georgetown/comments/bcho3r/psa_remember_the_human/,PSA: Remember the human,7,0,2019-04-12 12:22:54,"Hi everyone,

I wanted to issue a reminder that even when addressing controversial issues - such as the recent development on campus - to please keep things civil.

More specifically, please bear in mind the rules (3 &amp; 4 in particular) and remember the human behind the screen you’re corresponding with when posting a submission or comment(s).

Troll accounts, spam, and harassing comments will continued to be culled and banned where necessary.

Thanks."
bno9f1,https://www.reddit.com/r/georgetown/comments/bno9f1/georgetown_law_housing/,Georgetown Law Housing,5,3,2019-05-12 05:05:50,"Hi, I'm joining GLS this August for the LL.M programme. Wanted to know whether accommodation at the University housing would be better than staying outside? A 2BHK at the University housing costs about $6000 per semester including utilities. Also, wanted to know whether cycling to classes from University housing would be an option? Someone told me the University area is hilly."
bufehy,https://www.reddit.com/r/georgetown/comments/bufehy/those_who_got_accepted_into_georgetown_what_were/,"Those who got accepted into Georgetown, what were your stats/ECs?",4,2,2019-05-29 07:33:10,"Also, what was the school you applied for?"
c2qh9d,https://www.reddit.com/r/georgetown/comments/c2qh9d/whos_this_guts_bus_driver/,Who’s this GUTS bus driver?,13,3,2019-06-19 19:46:16,"Currently taking a summer course and commuting to campus everyday. I take the metro to Rosslyn. The greatest, most cheerful bus driver ever picks me up every morning at around 10:30 am. I’m just wondering if any of you know his name. Every time he drops us off to campus he’s like “HAVE YOURSELF A GOD BLESSSSS YOU DAY!” Man, I just love his energy. S/o to him for always brightening up my day : )"
c9749m,https://www.reddit.com/r/georgetown/comments/c9749m/happy_4th_hoyas/,Happy 4th Hoyas!,14,0,2019-07-04 13:12:12,Stay safe out there!
coa3dn,https://www.reddit.com/r/georgetown/comments/coa3dn/what_does_an_internship_look_like_with_a/,What does an internship look like with a congressman during the Fall Semester?,7,0,2019-08-09 16:09:57,"I assume some of you have done it as you all go to Georgetown and the Hill is basically there. I have an opportunity to do one but was wondering if I was going to do work like copying papers and getting coffee? I only ask bc it’s either this or playing soccer my senior year (I’ve been playing varsity since sophomore year, but don’t plan on continuing in college)  By the way I am a high school student and would be working about 10-15 hours a week. Would it be worth it? And have any of you gotten paid or received a stipend. Bc taking the metro for 5 days a week for 4 and a half months is expensive."
cqzvzt,https://www.reddit.com/r/georgetown/comments/cqzvzt/favorite_student_organizations_at_georgetown/,favorite student organizations at georgetown?,7,7,2019-08-15 19:16:23,"rising sophomore trying to hear more about different orgs for next year. ([https://www.reddit.com/r/georgetown/comments/cd9zu1/rising\_sophmore\_who\_had\_a\_hard\_time\_socially\_last/](https://www.reddit.com/r/georgetown/comments/cd9zu1/rising_sophmore_who_had_a_hard_time_socially_last/) if you want a deeper read about my freshman year struggles lol) 

i have a pretty good list of clubs that i wanna look more into, like GPB, gives, hoyablue, and then the bigs ones like the corp and blue and gray. however, i know that there are way more things to get involved with on campus. 

so feel free to share your favorite club or organization that you are/were involved on campus! im looking for ones that have a social aspect as well as being stimulating and interesting (like a consulting club)"
d46na9,https://www.reddit.com/r/georgetown/comments/d46na9/culture_at_georgetown/,Culture at Georgetown,8,12,2019-09-14 08:30:32,"I'm a senior who will be applying this year (I know we're probably inundating this subreddit with questions at this point, so apologies for that), and I'm interested in finding out what the culture at Georgetown is like. Is it more competitive or collaborative? How intense are people about academics? What are relationships like between students and groups?

Thanks in advance for any answers!"
diabcj,https://www.reddit.com/r/georgetown/comments/diabcj/summer_experiences/,summer experiences,6,7,2019-10-15 09:26:59,"hi all, just another sfs kid here who might come off as super ambitious, but i was wondering what your experiences during the summer before sophomore year is like. do i apply for internships and try to pay for a summer in dc? do i go abroad? what do people even do that summer? please share! thanks :)"
djx1h3,https://www.reddit.com/r/georgetown/comments/djx1h3/goodbye/,goodbye,4,18,2019-10-18 18:20:04,"got a 710 on the math 2 &amp; 650 on the us history subject test lol, time to say goodbye to georgetown 🤩🤩🤩"
dsbg3d,https://www.reddit.com/r/georgetown/comments/dsbg3d/georgetown_ms_in_foreign_service_applicant/,Georgetown MS in Foreign Service Applicant. Looking for feedback,4,0,2019-11-05 20:53:23,"I am a recent undergrad graduate looking to apply to the MS in Foreign Service at Georgetown.

I was wondering if there were any current MS in Foreign Service students on here that I could chat with and gain some feedback/constructive criticism on my application. Thanks and no worries if no-one is able!"
e9zcyp,https://www.reddit.com/r/georgetown/comments/e9zcyp/ea_decision_datetime/,EA Decision date/time?,1,2,2019-12-12 20:51:48,"Hi! I'm an international student, awaiting my decision. Does anyone know when Georgetown Early Action decisions are going to be released? They haven't given a date/time. It would be super helpful if somebody could tell me. Thanks!"
ej6gck,https://www.reddit.com/r/georgetown/comments/ej6gck/guts_reliability/,GUTS reliability,7,18,2020-01-02 15:38:48,"I have an internship next semester for 4 days a week and have about 30-ish minutes to get to dupont from class. My plan was the take the GUTS bus back and forth. Is this plausible? If not, how much time should I give myself?"
ewcpus,https://www.reddit.com/r/georgetown/comments/ewcpus/the_best_way_to_get_organized_for_coursework/,The best way to get organized for coursework,1,0,2020-01-30 13:33:25,"If you haven't tried [syllabuddy.com](https://syllabuddy.com/), you should.

It automatically transfers due dates from your syllabus to your Google/Apple calendar."
