id,url,title,score,num_comments,created_utc,selftext
eyiqxt,https://www.reddit.com/r/georgetown/comments/eyiqxt/questions_about_sfs_from_a_prospective_student/,Questions about SFS from a prospective student,1,4,2020-02-03 18:26:57,"Hi there, I'm a high school student and was recently admitted into Georgetown SFS for the class of 2024. I was planning on working towards the STIA major within SFS but when I was reading more about the program I came across the 3-2 Engineering Plan in conjunction with Columbia. I read on the SFS website that some STIA students have obtained this dual degree and I was just wondering if anyone has already gone through this process (or gotten a dual degree without SFS) and could share their difficulties/experiences. Thanks!"
freo5m,https://www.reddit.com/r/georgetown/comments/freo5m/internal_transfer_from_the_college_to_msb/,Internal Transfer from the College to MSB,3,6,2020-03-29 15:25:58,"Hi! I am a high school senior who is in the process of choosing a university to attend. Right now, Georgetown is my top choice, but I realized that I want to study finance in MSB instead of econ in the college. I have gotten into business schools at other universities and would consider attending those if I couldn't transfer to MSB. My questions are, how easy is it to transfer to MSB and how quickly could it be done? (if I started the process now) Thanks!"
fsffxj,https://www.reddit.com/r/georgetown/comments/fsffxj/premed_at_georgetown/,Pre-Med at Georgetown?,2,3,2020-03-31 08:57:38,"What makes pre-med at Georgetown unique compared to other top 20 schools? Can anyone speak to specific experiences, opportunities, academic &amp; extracurriculars advantages, chances of admittance to top 10 medical schools in the country, etc 

- prefrosh deciding between Georgetown, WashU, Emory, USC, and Pomona"
g1tuoo,https://www.reddit.com/r/georgetown/comments/g1tuoo/cancellation_of_oncampus_summer_programming_and/,Cancellation of On-Campus Summer Programming and Transitions to Virtual Delivery,11,0,2020-04-15 08:15:21,"*Email transcript from the Office of the President to all faculty and staff:*

---

Dear Georgetown Faculty and Staff,

As we approach the final weeks of the spring semester, we continue to navigate the challenges the COVID-19 pandemic has presented to our community. At the end of last month, we announced that all [Main Campus Summer 2020 instruction would be moved to virtual delivery](http://links.georgetown.mkt6170.com/ctt?kn=2&amp;ms=NDIyNjgwMTQS1&amp;r=NzE1OTM0OTU3OTIS1&amp;b=0&amp;j=MTc0MTU4NzE5OQS2&amp;mt=1&amp;rt=0). The Law Center also moved online all of its summer classes for continuing J.D. and LL.M students. 

In addition to the continuation of the virtual learning environment, today we are announcing that **all in-person summer programs scheduled to be held on the Main Campus, the School of Continuing Studies campus and Law Center campus through August 9, 2020 will need to be shifted to an online-only format or otherwise be canceled.**

With approaching summer program deadlines and continuing uncertainty regarding the duration of “stay-at-home orders” and social distancing guidelines, we concluded that this is the best course of action to ensure the health and safety for all. No in-person housing, event or athletic space will be provided for summer programming, including camps and conferences. All Main Campus summer conference deposits through August 9 will be fully refunded. As we move forward, we will prioritize Main Campus orientation programs and pre-sessions associated with the fall semester. For more information, please contact conferencehousing@georgetown.edu.

We recognize there are several academic programs at the Medical Center and Law Center that are part of the upcoming academic year and that would typically begin in July or early August, prior to August 9. Participants in those programs will hear directly from their program directors in the weeks ahead with information on the delivery of those activities.

We will be following-up on [travel guidance](http://links.georgetown.mkt6170.com/ctt?kn=1&amp;ms=NDIyNjgwMTQS1&amp;r=NzE1OTM0OTU3OTIS1&amp;b=0&amp;j=MTc0MTU4NzE5OQS2&amp;mt=1&amp;rt=0) for the summer in the days ahead.

As a reminder, the Center for New Designs in Learning and Scholarship (CNDLS) is available to support faculty and staff in transitioning programs and activities to remote formats. If, after careful consideration, a program cannot be transitioned to a virtual environment, it must be rescheduled or canceled. For all questions about the transition to virtual delivery for summer programs, please consult your program chairs, deans and department heads.

We understand how disruptive these necessary decisions are for our community. As we continue to evaluate the latest health guidance and safety procedures, we will revisit these decisions as circumstances allow. 

Thank you all for your commitment and dedication. We are very grateful for your extraordinary efforts.

Sincerely,

Geoffrey S. Chatas, Senior Vice President and Chief Operating Officer

Robert M. Groves, Provost

Edward B. Healton, Executive Vice President for Health Sciences and Executive Dean of the School of Medicine

William M. Treanor, Executive Vice President and Dean of the Law Center"
g3sdnd,https://www.reddit.com/r/georgetown/comments/g3sdnd/mcdonough_school_of_business/,McDonough School of Business,7,0,2020-04-18 11:29:29,"1. how is Mcdonough + how does it differ from the other business schools in the USA?

2. best major at Mcdonough?

3. thoughts on taking business as an undergraduate major?"
gl6e49,https://www.reddit.com/r/georgetown/comments/gl6e49/justice_and_peace_studies_major/,Justice and Peace Studies major,3,5,2020-05-16 18:13:06,Hi everyone! I'm considering applying to Georgetown's Justice and Peace Studies program and was wondering if anyone here is in the major or knows anything about it?
gny34e,https://www.reddit.com/r/georgetown/comments/gny34e/if_i_am_in_nhs_can_i_minor_in_something_in_a/,if i am in NHS can i minor in something in a different school?,2,2,2020-05-21 07:42:23,ex. In NHS but minor in something in MSB
ge4cwa,https://www.reddit.com/r/georgetown/comments/ge4cwa/what_options_for_housing_do_sophomores_have/,What options for housing do sophomores have?,2,7,2020-05-05 12:31:45,Also when are deadlines to pick housing?
h01yvs,https://www.reddit.com/r/georgetown/comments/h01yvs/update_on_our_fall_2020_planning/,Update on our Fall 2020 Planning,9,6,2020-06-09 19:27:45,"*Email transcript from the Office of the President:*

---

June 9, 2020

Dear Members of the Georgetown University Community:

As we begin our summer period, I wish to provide an overview of how we are preparing for the coming academic year, the practical assumptions that are guiding our decision-making, and what will be important for us to return to our campuses this Fall.  Since the very beginning of the pandemic, our community has come together in extraordinary ways, and I wish to again thank you for how you have enabled our University to respond, as we confront the challenges and the uncertainty of this moment.

We face complex and challenging decisions that require the most careful planning and preparation.  We are focused on the ways that we can protect the health and safety of each member of our community and pursue our academic mission during a time of serious risk and uncertainty.  We are animated by moral commitments that have shaped our community since our founding—including *cura personalis*, a deep sense of care for each person—and our commitment to the three foundational aspects of our mission—the formation of our students; the inquiry of our faculty; and our service to the common good.

This has been a time of great difficulty.  Many of us are experiencing deep grief and pain for the people we have lost and the ways that our lives have been impacted as a result of this global pandemic.  We realize, with particular pain, the disproportionate experience of the worst impacts of COVID-19 on essential workers—in healthcare, in roles that support our daily lives—and in African American communities and communities of color.  We recognize the imperative we have, moving forward, of strengthening our vision of a community deeply invested in the care of each person.  Doing so requires us to direct our energy not only to our response to COVID-19, but also to issues of equity and justice, and to issues of racism, violence and police brutality that we must now face with renewed urgency.  As I shared in my [letter to our community on May 31](https://president.georgetown.edu/confronting-racism-may-2020/?utm_source=SilverpopMailing&amp;utm_medium=email&amp;utm_campaign=Update%20on%20Fall%20Planning%20(1)&amp;utm_content=), this is a moment that demands our personal, civic, and institutional engagement.

**Planning for Fall**

As we approach the Fall, our planning is focused on how we can provide for the safe return of the members of our community and how we can work to sustain their safety over the course of their time at Georgetown—in our residence halls, classrooms, and gathering places across our campuses, given the risks posed by COVID-19.

Over the past several weeks, we have convened groups of colleagues to support planning efforts in key areas, including public health, academic options, operations, and finance.  On our faculty, we have some of the world’s leading experts in public health and these colleagues have helped us understand the range of actions and conditions that will enable us to safely return to our campuses.  Our academic leaders have worked to develop hybrid and flexible approaches to sustaining our educational mission as the conditions of the pandemic change. And our operations and finance colleagues are developing frameworks to support and sustain a return to campus.

**ReOpen DC**

It is important to understand that we are developing our plans within the framework provided by [ReOpen DC—the plan for the District of Columbia](https://coronavirus.dc.gov/reopendc). Returning to our campuses will require the approval of city authorities.  The *ReOpen DC* plan was released on May 21, and it outlines a four-stage approach for the city’s reopening, including the reopening of colleges and universities.

On May 29, Mayor Muriel Bowser announced that the District would move into Phase One of its plan, which lifts the “stay-at-home order” that she imposed on March 30 and provides for the resumption of “*certain activities—where the risk of transmission has been determined to be low and when strong safeguards are in place…*”  Phase One continues to require social distancing of at least six feet from persons not in one’s household, wearing a mask or face covering, and the prohibition of gatherings of more than ten individuals.  Colleges and universities in the District of Columbia are not permitted to resume on-campus activities under Phase One.

*ReOpen DC* stipulates that colleges and universities will be able to resume on-campus activities once two conditions are met: first, the city moves into Phase Two, and second, the city approves each college and university’s plan for returning to campus. Over the past few weeks, our colleagues here at Georgetown have been deeply engaged in the development of these plans.

**Practical Assumptions**

In developing our plans, we are guided by a set of assumptions that inform our work:

*Health and Safety*:  Our first priority is to the health and safety of our community—students, faculty, and staff.  We will be guided by the data, evidence, and expertise of our scientific and public health communities.

*Academic Mission*: It is in the interest of our academic mission to welcome as many students as is safely possible to in-person instruction in the Fall.

*Timing of Medical Advances*: We do not see significant advances in a safe and effective vaccine becoming widely available by the end of 2020.

*Layered Public Health Framework*: We will be able to implement a layered public health framework. Elements of a layered framework include regular self-screening for symptoms; temperature checks; social distancing; face coverings; readily available testing and contact tracing; isolation of those contracting the disease; quarantine for those with significant contact with those with the disease; deep cleaning of public spaces; and reducing crowd sizes.  While no framework can eliminate all risk, such a layered approach is integral to our efforts to work to mitigate risk.  We will identify the policies and processes that enable this commitment.

*Adherence*: Effective health and safety measures depend on the active participation by members of our community.

*Hybrid-Flexible Academic Models*: We will be prepared to conduct hybrid and flexible models of learning that span a continuum from on-campus to fully-virtual, determined by relevant factors, including our ability to meet our public health responsibilities and the needs of our community.  We are preparing for multiple options depending upon the changing state of pandemic conditions in the District of Columbia and on our ability to fulfill our obligations for public health on the Georgetown campuses.

*Varying Impact*: The implications of COVID-19 result in impacts that vary in severity across different members of our community.  We will exert special effort to anticipate and address these variations.

*Differentiation of Academic Programs*: We will be adaptive to the differences across our academic programs.  The needs of Law, Medical, and Graduate education can differ from those of undergraduate and residential students.

*Financial Capacity*: We will have the financial resources to prepare for and support the 2020-2021 academic year.  Given the demands of putting in place the public health framework in support of the health and safety of our community, and strengthening the virtual learning environment, we do not yet know the full extent of the costs for this coming year.

*Infrastructure*: We will be able to adapt and expand the infrastructure of our campuses—including classrooms, laboratories, residence halls, dining halls—to address the new needs for public health.

*Second Surge of Infection*: We will have the capability of responding to the possibility of another surge of infection during the course of 2020-2021, in the event we experience such a threat to the health and safety of our community.

**Emerging Scenarios for the Fall**

These assumptions have guided our planning work and are shaping a range of scenarios that will provide us with the best opportunities to return to our campuses this Fall, should conditions allow.  We will continue to work closely with the District of Columbia Departments of Health and Planning to ensure that the plans we develop are in accordance with the framework of *ReOpen DC*.

Recognizing that the need to manage density will make it impossible to return to normal this Fall, we are exploring approaches ranging from fully-virtual to approaches that balance virtual learning with on-campus presence—understanding that the needs across our campuses require differentiated approaches.  The needs for managing the public health of a residential undergraduate community are different than those for our graduate students, as well as for our professional students at our Law Center, Medical Center, and School of Continuing Studies.  For example, the steps to support our research laboratories will be different from those for our libraries.

Robert Groves, our Provost, is coordinating the preparations regarding the modality of the undergraduate and graduate programs with the deans of the Main Campus; William Treanor, our Executive Vice President and Dean, is developing the elements of our J.D., S.J.D., and LL.M. programs at the Law Center; Edward Healton, our Executive Vice President and Executive Dean, is overseeing our planning for the return of our research community to the laboratories, the resumption of clinical training for our 3rd and 4th year Medical students and our range of Nursing programs, as well as our 1st and 2nd year Preclinical Medical education and our programs in Biomedical Graduate Education.

We are also developing approaches to bringing our employees back to campus.  Over the last few months, we have learned a great deal about how to operate effectively in an environment where a majority of our colleagues are working remotely.  As we develop approaches for a return to campus, we will assess which members of our workforce will need to prepare to return to campus, and which members can continue to work remotely as we navigate the circumstances of the pandemic.

Given our first priority is the health and safety of our community, and how much we are still learning about the virus, we will work closely with the members of our student body, faculty and staff to consider and address particular challenges they anticipate with a return to campus.

Beginning in the next few days, we will issue a series of communications on our planning for each of our campuses.  We will provide clear and regular communications as we reach greater clarity about the upcoming academic year, and specifically about the range of fully-virtual to hybrid-flexible approaches that will guide each campus.  The most challenging set of issues, given the density of our residential campus, are those involving our undergraduates.  It is our intent to provide a full scope of our plans over the course of the coming weeks.

I am deeply grateful to all of our colleagues whose work is ensuring we can be prepared for this Fall.

I wish each of you the very best as we navigate this moment together, supported by one another and the enduring values that bind us as a community.  You have my deepest appreciation.

Sincerely,

John J. DeGioia"
h77g8f,https://www.reddit.com/r/georgetown/comments/h77g8f/chem_001009_vs_chem_055057/,CHEM 001/009 vs CHEM 055/057,8,7,2020-06-11 14:54:13,"Hi, 

Incoming freshman student who just spoke to my advisor today.

To my knowledge, Gen Chem 001/009 tends to be larger and Chem 055/057 tends to smaller/more focused. I've heard horror stories about the Chem department so which class would be less ""scary""? I guess what I'm asking is if there are any horror stories between the different sections of these classes?   Which ones have bad reputations? As a Biochemistry major looking to switch into Biology before the fall semester, my advisor is letting me choose which one to schedule myself into.

Thanks!"
hqygch,https://www.reddit.com/r/georgetown/comments/hqygch/who_is_the_best_hoya_youtuber/,Who is the best Hoya Youtuber?,10,0,2020-07-14 02:29:59,"For insights at Georgetown! (Other than Georgetown Stories, of course)"
hw8f6a,https://www.reddit.com/r/georgetown/comments/hw8f6a/virtual_learning_august_intensives_and_preos/,"Virtual learning, August Intensives, and Pre-Os",8,11,2020-07-22 20:28:40,"This fall, I'm going to be an incoming freshman, and while I know its an absolute privilege to be able to go to campus, I still have my concerns. My parents also want me to stay at home. What would I be missing if I stayed home instead of being on campus with the other freshman? 

I didn't apply for any August intensives, will that set me back? I can't help but feel like I'm going to have a super hard time compared to everyone else by the time fall comes around. 

What's the hype around Pre-Os? I forgot to have my essays written by the deadline, so I didn't apply for any. What am I missing out on?"
hwpict,https://www.reddit.com/r/georgetown/comments/hwpict/is_it_worth_staying_on_campus/,Is it worth staying on campus?,7,24,2020-07-23 15:24:17,"I am incoming freshman majoring in human science. All my classes except for bio lab will be online (even the chem lab surprisingly). Would it be worth it for me to go on campus? Right now, I have signed up housing because I thought it would help to get used to staying on campus?"
ig59mo,https://www.reddit.com/r/georgetown/comments/ig59mo/how_do_i_join_clubs/,How do I join clubs?,1,4,2020-08-24 21:26:20,"Hey everyone. I'm a freshman this year but haven't been able to go to many NSO activities as I'm in a different time zone which makes it inconvenient, so sorry if this has already been covered. My question is basically in the title; once I've found a club I like, how do I apply to join?"
i7h4gu,https://www.reddit.com/r/georgetown/comments/i7h4gu/need_help_picking_a_class/,Need help picking a class,1,3,2020-08-10 17:14:18,"I am a rising sophomore in the college. Please help me pick between these 3 classes. intro to islamic civ (omar), urban education (Wesley-Nero), and intro to anthro (Ibrahim). please help, thanks."
is9ycs,https://www.reddit.com/r/georgetown/comments/is9ycs/testing_policy/,Testing Policy,5,30,2020-09-13 17:09:04,Is anyone else extremely frustrated by the SAT/ACT required policy for Georgetown? 75% of seniors in Virginia weren’t able to take it and it really grinds my gears that they still require it. Do you think this will change? I was planning to apply and already paid the fee but this is really coloring my view of the school.
j2ahov,https://www.reddit.com/r/georgetown/comments/j2ahov/questions_from_a_high_school_senior/,questions from a high school senior,1,0,2020-09-29 16:12:16,"hi everybody, I’m a senior in high school and I’ve been debating on whether or not to apply to georgetown and whether or not it’s my top choice. I attended one of their summer high school programs and really enjoyed it, but obviously it was on zoom so I don’t really know if I got the correct vibe. I have a few questions that I think might help me decide:

1. Do students get an opportunity to be creative? For example, are classes hands on, are there arts-related events on campus, are there specific classes or electives people can take related to arts and writing?

2. How much does administration affect daily life? I’ve heard from other students that they can be kind of strict and inconvenient. 

3. Does georgetown offer quality student resources? I don’t have a solid idea of what degree or career I’m looking into so I really want programs or services that I can turn to, like career guidance or faculty that is available to talk. Do you or someone you know have experience being an undecided major?

4. This one is more general, but do students have fun? Have you enjoyed your time at Georgetown, and is there anything you wish you could change?

5. What does a typical class look like? Mainly lectures, labs, projects, etc? I’m looking more for a school that doesn’t just feel like harder high school classes, but like I’m really learning quality information in a quality manner. 

6. This isn’t so much a question but more of a worry: one thing that is holding me back is that I’m not super interested in the SFS or any of their speciality schools, so I’m worried that it wouldn’t be worth it to apply as someone in the College because it’s not what Georgetown is really known from what I’ve seen. Can anyone in the College talk about their experience?

Thank you so much!"
jlvtls,https://www.reddit.com/r/georgetown/comments/jlvtls/can_transfer_students_change_majors_within_the_sfs/,Can transfer students change majors within the SFS?,1,12,2020-10-31 20:30:12,I'm attempting to transfer into GU and into the SFS. I just wanted to know if you're allowed to change majors within the SFS. So would I be able to go from International Econ to International Politics?
j7ov14,https://www.reddit.com/r/georgetown/comments/j7ov14/apartmentgrouphomes_accessible_to_georgetown/,Apartment/Group-homes accessible to Georgetown University and Tysons Corner,1,2,2020-10-08 17:17:46,"Hi everyone,

I am looking for an apartment to live in that is close enough to GU for when classes start again, but also not too far from Tysons for my part-time job. I heard that Falls Church is a good option, but are there any other places I am missing that I should look into (Silver Spring, etc.)? Looking to spend less than $1000, so I know that pretty much removes most of DC from consideration. 

I do also work in Baltimore, but my hours are part of the graveyard shift so I am hoping traffic will be minimal/non-existent."
