id,url,title,score,num_comments,created_utc,selftext
jvgh12,https://www.reddit.com/r/georgetown/comments/jvgh12/announcement_regarding_our_spring_2021_plan/,Announcement regarding our Spring 2021 Plan,14,7,2020-11-16 14:14:10,"*Email transcript from the Office of the President*:

---

November 16, 2020

Dear Members of the Georgetown University Community:

I write today to share details about Georgetown’s plans for the Spring semester. In this message, I will provide information about our Spring approach, which will focus on bringing seniors back to campus and providing some in-person learning experiences for seniors, graduate and professional students. Our campus leaders will soon send you follow-up messages with more detail about the Spring on particular campuses.

These are profoundly hard decisions, and in navigating through this difficult time, we are guided by our first priority—the safety of our community. It is a foundation for all of our decision-making. I recognize the weariness that many of us feel about the impacts of this pandemic—the disruptions and restrictions on daily life, how much it has upended our routines. For all of us, this is not how we would like to be operating and I understand the disappointment and frustration that comes with these circumstances.

As I write to you today, we are experiencing an unprecedented surge of COVID-19 infections in the United States. COVID-19 cases in our country are higher than they have ever been and are rising exponentially. My [weekly video presentation](http://links.georgetown.mkt6170.com/els/v1/erz3fLx24xB7/M1lXV1ZTRHdIc3N3S0N6OWZJcjFVeEg3VkVlb3k5bUtXYjRFSGJiZVJUYXhvUW80ODlBWVlyQU5aUGFpcmRvNE1CK2FKZndZbFQ3U1dXbTY0dUVDeHVjY3lhUVZJRE5vbEdmckZOTEx6Ylk9S0/) describes some of the decisions that I outline below and provides additional context on the extremely serious situation we are all facing. As I share in the video, all of our plans are provisional and subject to modification. Our plan will also be submitted for review and acceptance by the Washington, D.C. government.

**Residential Community**

This Fall, we had approximately 500 students living in our residence halls on the Main Campus. Going forward, we plan to double this number, bringing back approximately 500 additional seniors, members of the undergraduate Class of 2021, who currently live outside of the Washington, D.C. area. Seniors will hear from the Office of Residential Living tomorrow, November 17, with more details on this process. Additionally, a small number of exceptions may be granted for undergraduate students whose living situations have changed substantially and who no longer have stable housing. Our Law Center will also increase the number of residential students on our Law campus.

We know how eager the members of our community are to return, particularly our first-year and transfer students who have had to delay the beginning of their time on campus, and the disappointment that comes with this decision. Given the current state of the pandemic, we are not able to bring more members of our community to campus at this time. We will continue to monitor this closely and will be prepared to bring additional students to campus, should conditions considerably improve.

For the undergraduate Class of 2024, we are developing a special residential Summer semester that will provide an opportunity for students to live on campus and take credit-bearing courses before they begin their sophomore year, provided public health conditions allow. This program will be optional and will allow students additional time to experience residential life at Georgetown.

**Mode of Instruction**

All courses will be offered virtually.

On the Main Campus, we are planning to introduce some hybrid courses—virtual courses that have in-person components—for senior undergraduate students—both those in residence on campus and those living in the Washington, D.C., area—and for students in the Graduate School.

This semester we implemented 17 pilot programs to explore in-person learning. In the Spring, contingent on pandemic conditions, we are planning approximately 200 hybrid courses for senior undergraduate and graduate students on the Main Campus.

We are also planning for some hybrid academic experiences for Medical, Nursing, and Law students. These programs will provide some students the option of being physically present in the classroom for in-person elements of a course, as conditions permit. All of our students will receive specific, detailed information about the hybrid approaches for their school or academic program. Our School of Continuing Studies has previously announced its intention to be virtual in the Spring.

We will follow a revised academic calendar, with undergraduate courses beginning on January 25. Specific details regarding the updated calendar will be provided by appropriate schools and programs.

**Study and Recreation Opportunities**

Over the course of the Spring semester, we are looking at providing new opportunities for studying and gathering on campus. A reservation system will provide access to certain key campus locations—with strict adherence to our public health program, including participation in our [Community Compact](http://links.georgetown.mkt6170.com/els/v1/j~g_BdRekRJR/M1lXV1ZTRHdIc3N3S0N6OWZJcjFVeEg3VkVlb3k5bUtXYjRFSGJiZVJUYXhvUW80ODlBWVlyQU5aUGFpcmRvNE1CK2FKZndZbFQ3U1dXbTY0dUVDeHVjY3lhUVZJRE5vbEdmckZOTEx6Ylk9S0/QVptR0lKWUJ5S0FxRFNrTXhhMjFxZ3NkYVYwVXVBNXpyaTZpaUVDL2ErZGlIMy9rYkdHbFZFeXM1bDNhaElySAS2), testing, mask wearing, physical distancing, and limited gathering sizes. On the Main Campus, we will be rolling out access gradually and prioritizing seniors and residential students first. We are also looking at opening spaces specific to graduate and professional students. We may need to modify our approach as conditions of the pandemic change or local ordinances about physical space and public health are updated.

**WeWork Partnership**

We are working to provide domestic and international students with access to quiet study spaces and internet access off campus, at no cost, through a new partnership with WeWork, which has office space for individuals in 800 locations in 32 U.S. cities and in 88 cities around the world.

**Our Planning**

Throughout these past few months, we have been guided by local and national public health experts and public health ordinances, and we have closely followed the work of researchers to deepen our understanding of the virus. We reviewed [our assumptions](http://links.georgetown.mkt6170.com/els/v1/6dqYcjYm_YFm/M1lXV1ZTRHdIc3N3S0N6OWZJcjFVeEg3VkVlb3k5bUtXYjRFSGJiZVJUYXhvUW80ODlBWVlyQU5aUGFpcmRvNE1CK2FKZndZbFQ3U1dXbTY0dUVDeHVjY3lhUVZJRE5vbEdmckZOTEx6Ylk9S0/) and [our approach](http://links.georgetown.mkt6170.com/els/v1/RaE9TzYepYT8/M1lXV1ZTRHdIc3N3S0N6OWZJcjFVeEg3VkVlb3k5bUtXYjRFSGJiZVJUYXhvUW80ODlBWVlyQU5aUGFpcmRvNE1CK2FKZndZbFQ3U1dXbTY0dUVDeHVjY3lhUVZJRE5vbEdmckZOTEx6Ylk9S0/) with our public health team—whose members have expertise in infectious diseases, public health, global health, epidemiology, vaccines, and health law and who have helped us to interpret and project how COVID-19 might impact our community. These are individuals working in clinical settings—treating patients of all ages who have been diagnosed with COVID-19—laboratory researchers, and physician-scientists who are conducting their own research, and policy and legal professionals who have additional responsibilities advising entities around the world on the COVID-19 response.

Our faculty have provided extensive input as part of our academic planning. They have also taken seriously the responsibility to develop [engaging virtual courses](http://links.georgetown.mkt6170.com/els/v1/baGdTZd8YdHb/M1lXV1ZTRHdIc3N3S0N6OWZJcjFVeEg3VkVlb3k5bUtXYjRFSGJiZVJUYXhvUW80ODlBWVlyQU5aUGFpcmRvNE1CK2FKZndZbFQ3U1dXbTY0dUVDeHVjY3lhUVZJRE5vbEdmckZOTEx6Ylk9S0/) and continue to refine their approaches in response to student feedback. We have held regular forums with members of our staff, going back to last Spring, to share updates and respond to questions. We have also engaged the members of our Board of Directors and our special Board working group who have advised us as we developed our plans. We have consulted with graduate and undergraduate students, and we have heard from many families about how best to approach the Spring.

I know that this is not the message that many in our community hoped to hear when looking ahead to next semester. We understand the disappointment in not being able to fully return to campus and how eager our community is to be together in person. We recognize how important a residential experience can be in the lives of our students and appreciate the strong desire to return to residential life.

These are challenging decisions. We will continue to monitor the state of the pandemic and may find it necessary to make adjustments at a future time. In the coming days, you will receive additional information from your campus leaders. I also encourage you to visit the University’s [COVID-19 Resource Center website](http://links.georgetown.mkt6170.com/els/v1/XX8NsbWzwWsx/M1lXV1ZTRHdIc3N3S0N6OWZJcjFVeEg3VkVlb3k5bUtXYjRFSGJiZVJUYXhvUW80ODlBWVlyQU5aUGFpcmRvNE1CK2FKZndZbFQ3U1dXbTY0dUVDeHVjY3lhUVZJRE5vbEdmckZOTEx6Ylk9S0/QVptR0lKWUJ5S0FxRFNrTXhhMjFxZ3NkYVYwVXVBNXpyaTZpaUVDL2ErZGlIMy9rYkdHbFZFeXM1bDNhaElySAS2) and these [frequently asked questions](http://links.georgetown.mkt6170.com/els/v1/GRGysx_9a_T0/M1lXV1ZTRHdIc3N3S0N6OWZJcjFVeEg3VkVlb3k5bUtXYjRFSGJiZVJUYXhvUW80ODlBWVlyQU5aUGFpcmRvNE1CK2FKZndZbFQ3U1dXbTY0dUVDeHVjY3lhUVZJRE5vbEdmckZOTEx6Ylk9S0/QVptR0lKWUJ5S0FxRFNrTXhhMjFxZ3NkYVYwVXVBNXpyaTZpaUVDL2ErZGlIMy9rYkdHbFZFeXM1bDNhaElySAS2), which are updated regularly. If you have additional questions, please call the University’s COVID-19 Helpline at 202-784-3510 (available 9 a.m. to 5 p.m. ET Monday to Friday) or email **covid19-questions@georgetown.edu** to be connected to the appropriate University representative to answer your question.

We are a community of 26,000 people. The virus impacts all of us. The actions we take have an impact on those around us. We share these plans with you at a very uncertain and challenging time. As we enter the winter months—widely anticipated as the most dangerous time for the pandemic—we face uncontrolled spread of COVID-19 in nearly all states. We will be closely following the trajectory of the pandemic and making adjustments to our plans, guided by our commitment to the health and safety of our community.

Our colleagues have worked tirelessly this past semester to sustain our virtual learning environment, to implement our public health program, and to develop these plans for the Spring. I cannot express deeply enough my appreciation for our faculty, our students, and our staff. For the ways that our University has come together, supported one another, and cared for our community, I am sincerely grateful.

Sincerely,

John J. DeGioia"
jv0ecy,https://www.reddit.com/r/georgetown/comments/jv0ecy/atheists_at_georgetown/,Atheists at Georgetown?,9,21,2020-11-15 20:20:23,"First, I’m a senior that’s planning on applying to Georgetown this year. 

So I’m aware Georgetown has strong Jesuit values and I really align with a lot of them, and I’m also really interested in theology, but I’m an atheist. I was just wondering if any atheist or nonreligious people could tell me about their experience at Georgetown? How much is religion emphasized at the school?"
kfvmu7,https://www.reddit.com/r/georgetown/comments/kfvmu7/gift_idea_gu_medicine_pom_hat/,Gift Idea - GU Medicine Pom Hat,4,4,2020-12-18 14:48:24,"Hi,
My girlfriend went to GU for undergrad and Med school. I saw a girl walking today with a Pom beanie with ‘Temple Medicine’ on it. I thought it was a cool gift idea, but couldn’t find anything similar on GU apparel website. I looked into making a custom Pom hat but they wouldn’t let me customize to get the GU colors. Any ideas as to where/how I could get something like that?
Thanks!"
kffqre,https://www.reddit.com/r/georgetown/comments/kffqre/is_georgetown_chillfun/,Is Georgetown chill/fun?,2,31,2020-12-17 22:21:04,"I got in EA but there are a few things I was wondering about -

The school seems extremely study/work based. To be blunt - is it fun? Or do you spend pretty much all of your time studying or going to class?

I get the impression the dorms and food suck. Is this the case?

Are a lot of people thee SJW/their whole personality is their political views?

Is the campus nice?

Thanks to anyone who answers. Any other information that might help me decide if I want to go to Georgetown is appreciated."
kcm6kr,https://www.reddit.com/r/georgetown/comments/kcm6kr/news/,NEWS,1,7,2020-12-13 16:08:07,I JUST GOT ACCEPTED!!!
l991kx,https://www.reddit.com/r/georgetown/comments/l991kx/early_assurance_law_program/,Early Assurance Law program.,9,9,2021-01-31 01:31:42,How many people get in? What’s the acceptance rate?
kvvtsp,https://www.reddit.com/r/georgetown/comments/kvvtsp/is_there_any_way_i_can_bring_my_dog/,Is there any way I can bring my dog?,2,7,2021-01-12 09:12:02,"I just recently decided to apply to Georgetown so I haven’t looked too much into the school but I really like it so far and it’ll probably be my top school. So far I haven’t found anything that I don’t like except the housing requirement. At the school that used to be my top choice, I had planned on living in the dorms for a year and then getting an apartment and brining my dog. I know Georgetown has a three-year housing requirement, and my dog isn’t an ESA or a service dog so I couldn’t bring him into the dorms. It’s probably not possible but is there any way I could bypass the housing requirement? Even just being allowed to live off campus for junior and senior year would be fine. Bringing my dog is pretty important to me since I train him and am planning on doing trials with him in different sports. Has anyone else brought a pet to campus that wasn’t an ESA or a service dog?"
kzjj5r,https://www.reddit.com/r/georgetown/comments/kzjj5r/gtown_medical_academy_summer_program_personal/,Gtown medical academy summer program personal statement help,1,2,2021-01-17 17:04:19,"Hey, I am a junior in high school and I am in the process of submitting my application to the 1-3 week medical academy program at Georgetown University during the summer. I wrote my personal statement but I want to make sure that it's great as this program really means a lot to me. Has anyone been to this academy? If yes, then are there any specifics that they look for in their students or any specific values they look for? If no, are there any general tips that you can offer me to write a personal statement about why I want to attend the program?

Thank you for your help!"
lsgw61,https://www.reddit.com/r/georgetown/comments/lsgw61/can_i_visit_and_walk_around_campus/,can i “visit” and walk around campus?,19,12,2021-02-25 13:05:40,"i’m a prospective student, and i called admissions to find out if the campus was closed to the public currently. i’d like to come and just walk around the campus, even if i can’t go into the buildings. if i showed up to the campus, would i be allowed to walk around or would i be turned away?"
lh8eul,https://www.reddit.com/r/georgetown/comments/lh8eul/how_to_deal_with_club_rejection/,How to deal with club rejection?,3,15,2021-02-10 16:32:10,"I know it is not a personal rejection against me, but it just feels tough as a freshman who does not know anybody on campus/did not have anyone to network with. Got an interview with innovo, did not even make it past the application stage with Hilltop Consultants. I heard GUASFCU is getting easier to get into because they take a lot more applicants these days, so fingers crossed for that I guess."
lxzlff,https://www.reddit.com/r/georgetown/comments/lxzlff/is_anyone_actually_going_to_the_summer_thing_for/,Is anyone actually going to the summer thing for the class of ‘24,14,3,2021-03-04 16:27:29,Just wondering because I haven’t heard anyone talk about it lmao
m59t0b,https://www.reddit.com/r/georgetown/comments/m59t0b/thoughts_on_ma_in_security_studies/,Thoughts on MA in Security Studies?,1,10,2021-03-14 18:44:12,"Proxy post for someone recently admitted to Georgetown for a MA in Security Studies who's choosing between Georgetown and a couple of other IR programs. Can any current or past students comment their thoughts on the program? Looking for the good, the bad, and the ugly--any and all input is helpful. Thanks in advance!"
mk62of,https://www.reddit.com/r/georgetown/comments/mk62of/any_professor_recommendations_for_intro_to/,Any professor recommendations for Intro to Philosophy?,4,4,2021-04-04 15:07:58,"I’m a rising sophomore in the college, and I’m currently planning my schedule for next semester. I took a lot of philosophy coursework in high school, so I’d like to choose a fairly challenging section. I’ve got first registration block, so I’m hoping I’ll have my pick. Anyone have any professor recs I should look at?"
muw97s,https://www.reddit.com/r/georgetown/comments/muw97s/has_anyone_been_able_to_negotiate_with_the/,"Has anyone been able to negotiate with the Financial Aid office? Also, does Georgetown match competing offers from other colleges?",1,1,2021-04-20 10:57:59,"Hi

I got ridiculously lowballed by the office of financial aid and am working on appealing. If I include the fact that I’ve received several need-based and merit-based offers of aid from various competing schools, will this impact me favorably? I look online at the website and it doesn’t say that they don’t match offers from other colleges. 

Thanks so much!"
mjoa02,https://www.reddit.com/r/georgetown/comments/mjoa02/when_are_transfer_applicants_know_if_they_are/,When are transfer applicants know if they are accepted or not?,1,0,2021-04-03 20:42:51,I did my transfer process fairly late in the game i wonder how long would it take for my application to come back ? to see if i’m accepted or not
n4vf09,https://www.reddit.com/r/georgetown/comments/n4vf09/printing_services/,printing services??,2,6,2021-05-04 12:10:34,"ik this may be a weird question to ask, but are there areas where you can print stuff at freshman dorm buildings other than harbin? i know the library does have printing stations but it'll be nice to have somewhere to print close by. also, do students have to pay to print or is the service free? thank you in advance!"
nlycom,https://www.reddit.com/r/georgetown/comments/nlycom/does_georgetown_have_any_requirements_preferences/,Does Georgetown have any requirements / preferences of who we get out letters of recommendation from?,1,0,2021-05-26 20:15:35,I’m getting one from my English teacher and one from my med teacher . Is this fine?
o1besu,https://www.reddit.com/r/georgetown/comments/o1besu/current_gtown_undergrad_hire_for_a_few_hours_of/,Current G'Town undergrad: Hire for a few hours of private guiding?,18,6,2021-06-16 11:13:42,"My son is interested in exploring Georgetown however the on campus tours being offered (due to CoVID) are super limited.  Our family is fully vaccinated and I'm looking to ""life hack"" this  a bit.  I do **not** want to violate any rules... my thinking is that having someone to just point out buildings and talk a bit about your experience would be really helpful.

If you are a current (or recent) undergrad who's interested in being hired for a couple of hours + lunch would you kindly PM me?  We will be in DC roughly July 3-5th.

Thanks!"
nz724t,https://www.reddit.com/r/georgetown/comments/nz724t/how_to_prep_for_freshman_year/,How to prep for freshman year,7,19,2021-06-13 14:56:16,"I got into the SFS program and I'll be doing either Econ or intl politics, and I really need to know how to prepare for it.

writing, history, map of the modern world, theology, Econ, etc. 

how can I prepare for all that? I'm really hoping to keep a strong academic record and I'm afraid that I'll mess it up. please someone help."
o2w7im,https://www.reddit.com/r/georgetown/comments/o2w7im/triples_vs_doubles_housing/,Triples vs Doubles Housing,3,6,2021-06-18 11:03:53,"I am a rising sophomore in NHS and am trying to decide between a triple and double dorm. 

1. Are there advantages to getting a triple room over double room? Like more space per person, nicer rooms, closer to NHS classes

2. I see that there are fewer dorms with triple rooms compared to dorms with double rooms. Will this affect the housing  selection (None of the people I would be housing with have extra housing points (ie what’s a hoya) including myself)?"
obrqm7,https://www.reddit.com/r/georgetown/comments/obrqm7/question_about_computers/,Question about Computers,1,6,2021-07-01 11:17:10,"Does Georgetown provide laptops for students or do they have any programs in relation to student computers, or are students expected to bring their own?"
ovcllq,https://www.reddit.com/r/georgetown/comments/ovcllq/which_sports_are_most_beginnerfriendly/,which sports are most beginner-friendly?,1,14,2021-07-31 11:45:05,looking for a way to stay fit in college but it seems that all the club teams are quite competitive + looking for players with extensive experience in that sport.
p054fi,https://www.reddit.com/r/georgetown/comments/p054fi/any_georgetown_students_interesting_in_a_dog/,Any Georgetown students interesting in a dog sitting gig?,1,2,2021-08-07 17:56:22,"Hey everyone. I graduated law school this May and will be starting at a law firm in DC very soon. I'm still apartment hunting but I hope to end up in the Penn Quarter or Logan Circle area. My dog is \~15lbs and very, very chill. But she doesn't like to be alone for more than a few hours and she wouldn't do well going to a crowded doggie daycare 5x/week. On top of that, I'm worried that I'm going to have a lot of after-work events that will me from picking her up from daycare on time. 

I'm looking for some kind of arrangement where 3x/week you walk my dog after your classes are done (\~45m) and then just kind of hang out with her in my apartment for a couple hours afterward. You can watch HBO, eat my snacks, drink my wine, do your school work from my place, and hang out with my dog while she sleeps and gnaws on a rawhide. The apartment buildings I'm looking at have great amenities, so you can even hang out at the rooftop pool....just bring the doggie with you! I'm thinking 4-6ish? I haven't fully worked everything out, so I'm flexible and open to suggestions.

This is kind of an unconventional dog sitting gig, but I'm willing to pay well, pay cash, and feed you!"
p00n8m,https://www.reddit.com/r/georgetown/comments/p00n8m/government_classes/,Government Classes,1,2,2021-08-07 13:23:04,does Georgetown have any classes on political psychology and “how to campaign?” i can’t find this info on their website and the dept chair never emailed me back.
ptl94b,https://www.reddit.com/r/georgetown/comments/ptl94b/clubs/,clubs,2,1,2021-09-22 19:06:50,What r some good clubs/bars near georgetown that r lenient abt fakes?
pzkh6o,https://www.reddit.com/r/georgetown/comments/pzkh6o/political_leanings_of_those_at_georgetown/,Political leanings of those at Georgetown?,1,11,2021-10-01 17:13:31,"Interested in comparing the political leanings of different universities in Virginia/Maryland area (I know it’s not scientific but still interesting!) At least political leanings of those on Reddit. Add home town and gender!

[View Poll](https://www.reddit.com/poll/pzkh6o)"
qoc4d7,https://www.reddit.com/r/georgetown/comments/qoc4d7/parties_tonight/,Parties tonight,1,1,2021-11-06 16:35:16,"I’m a student at another university, my friends are here visiting. Any parties / frat parties going on at Georgetown tonight? 2 guys 2 girls 21-24"
rc7enf,https://www.reddit.com/r/georgetown/comments/rc7enf/international_students_how_did_you_make_friends/,International students: How did you make friends???,4,6,2021-12-08 18:27:09,"So I know COVID and everything but I am having the WORST time connecting with anyone. I don't even think I'm that bad of a person lol I'm just shy and I suppose that combined with the state of things isn't so great right now.

&amp;#x200B;

Any tips? Was there certain clubs? I'm 19, female, don't really have specific hobbies but am open to anything at this point basically"
